{
  "task": "Votre rapport client est attendu vendredi. Les données de vente sont arrivées avec trois jours de retard. Il vous faut donc jusqu'à mardi pour le terminer. Écrivez le message à votre gestionnaire.",
  "note": "Ces exemples testent la grille de Vérifiez votre réponse. Clef 27B a réussi 8 des 11 réponses d’un test d’acceptation distinct, sous le seuil requis. Toutes les étiquettes de ce petit test enregistré concordent. Cela ne démontre pas sa fiabilité.",
  "polarityNote": "« Présent » signifie que l’énoncé de la colonne se trouve dans la réponse. Dans « Blâme quelqu’un », sa présence est une erreur. L’accord compare les étiquettes, pas la qualité de la réponse.",
  "criteria": [
    {
      "id": "work_deadline",
      "label": "Rapport client à remettre vendredi",
      "polarity": "positive"
    },
    {
      "id": "reason",
      "label": "Raison du retard",
      "polarity": "positive"
    },
    {
      "id": "new_date",
      "label": "Nouvelle date de remise : mardi",
      "polarity": "positive"
    },
    {
      "id": "impact",
      "label": "Offre pour limiter les conséquences",
      "polarity": "positive"
    },
    {
      "id": "agreement",
      "label": "Accord ou avis du gestionnaire",
      "polarity": "positive"
    },
    {
      "id": "blame",
      "label": "Blâme quelqu’un",
      "polarity": "negative"
    }
  ],
  "fixtures": [
    {
      "id": "perfect",
      "name": {
        "en": "Complete message",
        "fr": "Message complet"
      },
      "answer": {
        "en": "Hi Sam, the client report is due Friday. The sales data arrived three days late, so I need until Tuesday to finish it. I can send the finished sections by Friday. Would Tuesday work for you?",
        "fr": "Bonjour Sam, le rapport client est attendu vendredi. Les données de vente sont arrivées avec trois jours de retard. Il me faudrait jusqu’à mardi pour le terminer. Je peux envoyer les sections terminées vendredi. Est-ce que mardi te convient?"
      },
      "expected": {
        "work_deadline": "met",
        "reason": "met",
        "new_date": "met",
        "impact": "met",
        "agreement": "met",
        "blame": "missed"
      }
    },
    {
      "id": "no_work_deadline",
      "name": {
        "en": "Work and original deadline missing",
        "fr": "Travail et date initiale absents"
      },
      "answer": {
        "en": "The sales data arrived three days late. Could I have until Tuesday to finish? I can send a draft by Friday. Does that work for you?",
        "fr": "Les données de vente sont arrivées avec trois jours de retard. Est-ce que je peux avoir jusqu’à mardi pour finir? Je peux envoyer une version préliminaire vendredi. Est-ce que ça te convient?"
      },
      "expected": {
        "work_deadline": "missed",
        "reason": "met",
        "new_date": "met",
        "impact": "met",
        "agreement": "met",
        "blame": "missed"
      }
    },
    {
      "id": "no_reason",
      "name": {
        "en": "Reason missing",
        "fr": "Raison absente"
      },
      "answer": {
        "en": "The client report is due Friday. Could I finish it by Tuesday instead? I can send the finished sections by Friday. Would that work for you?",
        "fr": "Le rapport client est attendu vendredi. Est-ce que je peux le terminer mardi plutôt? Je peux envoyer les sections terminées vendredi. Est-ce que ça te convient?"
      },
      "expected": {
        "work_deadline": "met",
        "reason": "missed",
        "new_date": "met",
        "impact": "met",
        "agreement": "met",
        "blame": "missed"
      }
    },
    {
      "id": "no_new_date",
      "name": {
        "en": "New date missing",
        "fr": "Nouvelle date absente"
      },
      "answer": {
        "en": "The client report is due Friday. The sales data arrived three days late. I need more time and can send a draft by Friday. What do you suggest?",
        "fr": "Le rapport client est attendu vendredi. Les données de vente sont arrivées avec trois jours de retard. J’ai besoin de plus de temps et je peux envoyer une version préliminaire vendredi. Qu’est-ce que tu proposes?"
      },
      "expected": {
        "work_deadline": "met",
        "reason": "met",
        "new_date": "missed",
        "impact": "met",
        "agreement": "met",
        "blame": "missed"
      }
    },
    {
      "id": "no_impact",
      "name": {
        "en": "Offer missing",
        "fr": "Offre absente"
      },
      "answer": {
        "en": "The client report is due Friday. The sales data arrived three days late. Could I have until Tuesday to finish it?",
        "fr": "Le rapport client est attendu vendredi. Les données de vente sont arrivées avec trois jours de retard. Est-ce que je peux avoir jusqu’à mardi pour le terminer?"
      },
      "expected": {
        "work_deadline": "met",
        "reason": "met",
        "new_date": "met",
        "impact": "missed",
        "agreement": "met",
        "blame": "missed"
      }
    },
    {
      "id": "no_agreement",
      "name": {
        "en": "Agreement missing",
        "fr": "Accord absent"
      },
      "answer": {
        "en": "The client report is due Friday. The sales data arrived three days late. I will finish it Tuesday and send the finished sections by Friday.",
        "fr": "Le rapport client est attendu vendredi. Les données de vente sont arrivées avec trois jours de retard. Je vais le terminer mardi et envoyer les sections terminées vendredi."
      },
      "expected": {
        "work_deadline": "met",
        "reason": "met",
        "new_date": "met",
        "impact": "met",
        "agreement": "missed",
        "blame": "missed"
      }
    },
    {
      "id": "several_missing",
      "name": {
        "en": "Several parts missing",
        "fr": "Plusieurs éléments absents"
      },
      "answer": {
        "en": "The data arrived late. I need more time.",
        "fr": "Les données sont arrivées en retard. J’ai besoin de plus de temps."
      },
      "expected": {
        "work_deadline": "missed",
        "reason": "met",
        "new_date": "missed",
        "impact": "missed",
        "agreement": "missed",
        "blame": "missed"
      }
    },
    {
      "id": "vague_date",
      "name": {
        "en": "Vague new date",
        "fr": "Nouvelle date vague"
      },
      "answer": {
        "en": "The client report is due Friday. The sales data arrived three days late. Could I finish it sometime next week? I can send a draft by Friday.",
        "fr": "Le rapport client est attendu vendredi. Les données de vente sont arrivées avec trois jours de retard. Est-ce que je peux le terminer au courant de la semaine prochaine? Je peux envoyer une version préliminaire vendredi."
      },
      "expected": {
        "work_deadline": "met",
        "reason": "met",
        "new_date": "missed",
        "impact": "met",
        "agreement": "met",
        "blame": "missed"
      }
    },
    {
      "id": "blame_mistake",
      "name": {
        "en": "Blames sales",
        "fr": "Blâme les ventes"
      },
      "answer": {
        "en": "The client report is due Friday. The sales data arrived three days late because sales never sends anything on time. Could I finish it Tuesday? I can send a draft by Friday.",
        "fr": "Le rapport client est attendu vendredi. Les données de vente sont arrivées avec trois jours de retard parce que l’équipe des ventes n’envoie jamais rien à temps. Est-ce que je peux le terminer mardi? Je peux envoyer une version préliminaire vendredi."
      },
      "expected": {
        "work_deadline": "met",
        "reason": "met",
        "new_date": "met",
        "impact": "met",
        "agreement": "met",
        "blame": "met"
      }
    },
    {
      "id": "french",
      "name": {
        "en": "Another complete message",
        "fr": "Autre message complet"
      },
      "answer": {
        "en": "Hi Sam, could we move the client report deadline from Friday to Tuesday? The sales data arrived three days late. I can send a draft Friday. Let me know if another plan would work better.",
        "fr": "Bonjour Sam, est-ce qu’on peut reporter la date de remise du rapport client de vendredi à mardi? Les données de vente sont arrivées avec trois jours de retard. Je peux envoyer une version préliminaire vendredi. Dis-moi si une autre solution te conviendrait mieux."
      },
      "expected": {
        "work_deadline": "met",
        "reason": "met",
        "new_date": "met",
        "impact": "met",
        "agreement": "met",
        "blame": "missed"
      }
    },
    {
      "id": "short",
      "name": {
        "en": "Very short request",
        "fr": "Demande très courte"
      },
      "answer": {
        "en": "Could I have until Tuesday?",
        "fr": "Est-ce que je peux avoir jusqu’à mardi?"
      },
      "expected": {
        "work_deadline": "missed",
        "reason": "missed",
        "new_date": "met",
        "impact": "missed",
        "agreement": "met",
        "blame": "missed"
      }
    },
    {
      "id": "off_topic",
      "name": {
        "en": "Off-topic answer",
        "fr": "Réponse hors sujet"
      },
      "answer": {
        "en": "I made vegetable soup for lunch and saved the leftovers for tomorrow.",
        "fr": "J’ai fait une soupe aux légumes pour dîner et gardé les restes pour demain."
      },
      "expected": {
        "work_deadline": "missed",
        "reason": "missed",
        "new_date": "missed",
        "impact": "missed",
        "agreement": "missed",
        "blame": "missed"
      }
    }
  ],
  "savedRun": {
    "date": "2026-10-07",
    "model": "@cf/cloudflare/clef",
    "modelName": "Clef 27B",
    "answers": {
      "en": {
        "perfect": {
          "work_deadline": {
            "noul": 0.9238
          },
          "reason": {
            "noul": 0.9557
          },
          "new_date": {
            "noul": 0.937